Script started on 2020-10-07 00:08:24-04:00 [TERM="xterm-256color" TTY="/dev/pts/2" COLUMNS="197" LINES="24"]
]0;pi@raspberrypi: ~[01;32mpi@raspberrypi[00m:[01;34m~ $[00m lscd libs/ls[Kcd ClusterODM/..[K[3Plscd testing/ls[Kcd test/sudo nano Node.js ls[Kcd classes/ls[Kcd libs/[3P..libs/ls[Kcd classes/ls[Ksudo nano Node.js [10Pcd test/ls[Kcd testing/ls[Kcd ..ClusterODM/ls[Kcd libs/ls[K[Klscd libs/ls[Kcd ClusterODM/..[K[3Plscd testing/ls[Kcd test/sudo nano Node.js ls[Ksudo nano Node.js [10Pcd test/ls[Kcd testing/ls[Kcd ..ClusterODM/ls[Kcd libs/ls[K[Ksudo tcpdump port 3000
tcpdump: verbose output suppressed, use -v or -vv for full protocol decode
listening on eth0, link-type EN10MB (Ethernet), capture size 262144 bytes
00:09:02.689516 IP 192.168.1.55.38218 > 192.168.1.56.3000: Flags [S], seq 1838940792, win 64240, options [mss 1460,sackOK,TS val 3937263729 ecr 0,nop,wscale 7], length 0
00:09:02.689653 IP 192.168.1.56.3000 > 192.168.1.55.38218: Flags [S.], seq 3955069221, ack 1838940793, win 65160, options [mss 1460,sackOK,TS val 41776131 ecr 3937263729,nop,wscale 7], length 0
00:09:02.689693 IP 192.168.1.55.38218 > 192.168.1.56.3000: Flags [.], ack 1, win 502, options [nop,nop,TS val 3937263729 ecr 41776131], length 0
00:09:02.691956 IP 192.168.1.55.38218 > 192.168.1.56.3000: Flags [P.], seq 1:139, ack 1, win 502, options [nop,nop,TS val 3937263731 ecr 41776131], length 138
00:09:02.692083 IP 192.168.1.56.3000 > 192.168.1.55.38218: Flags [.], ack 139, win 508, options [nop,nop,TS val 41776133 ecr 3937263731], length 0
00:09:02.697192 IP 192.168.1.56.3000 > 192.168.1.55.38218: Flags [.], seq 1:1449, ack 139, win 508, options [nop,nop,TS val 41776138 ecr 3937263731], length 1448
00:09:02.697249 IP 192.168.1.55.38218 > 192.168.1.56.3000: Flags [.], ack 1449, win 501, options [nop,nop,TS val 3937263736 ecr 41776138], length 0
00:09:02.697324 IP 192.168.1.56.3000 > 192.168.1.55.38218: Flags [P.], seq 1449:7241, ack 139, win 508, options [nop,nop,TS val 41776138 ecr 3937263731], length 5792
00:09:02.697330 IP 192.168.1.56.3000 > 192.168.1.55.38218: Flags [.], seq 7241:13033, ack 139, win 508, options [nop,nop,TS val 41776138 ecr 3937263731], length 5792
00:09:02.697352 IP 192.168.1.55.38218 > 192.168.1.56.3000: Flags [.], ack 7241, win 464, options [nop,nop,TS val 3937263736 ecr 41776138], length 0
00:09:02.697368 IP 192.168.1.55.38218 > 192.168.1.56.3000: Flags [.], ack 13033, win 426, options [nop,nop,TS val 3937263736 ecr 41776138], length 0
00:09:02.697390 IP 192.168.1.56.3000 > 192.168.1.55.38218: Flags [P.], seq 13033:14481, ack 139, win 508, options [nop,nop,TS val 41776138 ecr 3937263731], length 1448
00:09:02.697400 IP 192.168.1.55.38218 > 192.168.1.56.3000: Flags [.], ack 14481, win 417, options [nop,nop,TS val 3937263736 ecr 41776138], length 0
00:09:02.697476 IP 192.168.1.56.3000 > 192.168.1.55.38218: Flags [.], seq 14481:15929, ack 139, win 508, options [nop,nop,TS val 41776139 ecr 3937263736], length 1448
00:09:02.697490 IP 192.168.1.55.38218 > 192.168.1.56.3000: Flags [.], ack 15929, win 407, options [nop,nop,TS val 3937263737 ecr 41776139], length 0
00:09:02.697528 IP 192.168.1.56.3000 > 192.168.1.55.38218: Flags [P.], seq 15929:17453, ack 139, win 508, options [nop,nop,TS val 41776139 ecr 3937263736], length 1524
00:09:02.697542 IP 192.168.1.55.38218 > 192.168.1.56.3000: Flags [.], ack 17453, win 396, options [nop,nop,TS val 3937263737 ecr 41776139], length 0
00:09:02.698577 IP 192.168.1.56.3000 > 192.168.1.55.38218: Flags [F.], seq 17453, ack 139, win 508, options [nop,nop,TS val 41776140 ecr 3937263737], length 0
00:09:02.700643 IP 192.168.1.55.38218 > 192.168.1.56.3000: Flags [F.], seq 139, ack 17454, win 501, options [nop,nop,TS val 3937263740 ecr 41776140], length 0
00:09:02.700759 IP 192.168.1.56.3000 > 192.168.1.55.38218: Flags [.], ack 140, win 508, options [nop,nop,TS val 41776142 ecr 3937263740], length 0
00:09:02.856763 IP 192.168.1.55.38240 > 192.168.1.56.3000: Flags [S], seq 706777871, win 64240, options [mss 1460,sackOK,TS val 3937263896 ecr 0,nop,wscale 7], length 0
00:09:02.856909 IP 192.168.1.56.3000 > 192.168.1.55.38240: Flags [S.], seq 3159184698, ack 706777872, win 65160, options [mss 1460,sackOK,TS val 41776298 ecr 3937263896,nop,wscale 7], length 0
00:09:02.856959 IP 192.168.1.55.38240 > 192.168.1.56.3000: Flags [.], ack 1, win 502, options [nop,nop,TS val 3937263896 ecr 41776298], length 0
00:09:02.857346 IP 192.168.1.55.38240 > 192.168.1.56.3000: Flags [P.], seq 1:136, ack 1, win 502, options [nop,nop,TS val 3937263896 ecr 41776298], length 135
00:09:02.857444 IP 192.168.1.56.3000 > 192.168.1.55.38240: Flags [.], ack 136, win 509, options [nop,nop,TS val 41776299 ecr 3937263896], length 0
00:09:02.922184 IP 192.168.1.56.3000 > 192.168.1.55.38240: Flags [P.], seq 1:391, ack 136, win 509, options [nop,nop,TS val 41776363 ecr 3937263896], length 390
00:09:02.922243 IP 192.168.1.55.38240 > 192.168.1.56.3000: Flags [.], ack 391, win 501, options [nop,nop,TS val 3937263961 ecr 41776363], length 0
00:09:02.923178 IP 192.168.1.56.3000 > 192.168.1.55.38240: Flags [F.], seq 391, ack 136, win 509, options [nop,nop,TS val 41776364 ecr 3937263961], length 0
00:09:02.924852 IP 192.168.1.55.38242 > 192.168.1.56.3000: Flags [S], seq 3948846552, win 64240, options [mss 1460,sackOK,TS val 3937263964 ecr 0,nop,wscale 7], length 0
00:09:02.925000 IP 192.168.1.56.3000 > 192.168.1.55.38242: Flags [S.], seq 2489924797, ack 3948846553, win 65160, options [mss 1460,sackOK,TS val 41776366 ecr 3937263964,nop,wscale 7], length 0
00:09:02.925054 IP 192.168.1.55.38242 > 192.168.1.56.3000: Flags [.], ack 1, win 502, options [nop,nop,TS val 3937263964 ecr 41776366], length 0
00:09:02.925411 IP 192.168.1.55.38240 > 192.168.1.56.3000: Flags [F.], seq 136, ack 392, win 501, options [nop,nop,TS val 3937263964 ecr 41776364], length 0
00:09:02.925529 IP 192.168.1.56.3000 > 192.168.1.55.38240: Flags [.], ack 137, win 509, options [nop,nop,TS val 41776367 ecr 3937263964], length 0
00:09:02.925737 IP 192.168.1.55.38242 > 192.168.1.56.3000: Flags [P.], seq 1:139, ack 1, win 502, options [nop,nop,TS val 3937263965 ecr 41776366], length 138
00:09:02.925847 IP 192.168.1.56.3000 > 192.168.1.55.38242: Flags [.], ack 139, win 508, options [nop,nop,TS val 41776367 ecr 3937263965], length 0
00:09:02.930853 IP 192.168.1.56.3000 > 192.168.1.55.38242: Flags [.], seq 1:1449, ack 139, win 508, options [nop,nop,TS val 41776372 ecr 3937263965], length 1448
00:09:02.930918 IP 192.168.1.55.38242 > 192.168.1.56.3000: Flags [.], ack 1449, win 501, options [nop,nop,TS val 3937263970 ecr 41776372], length 0
00:09:02.931035 IP 192.168.1.56.3000 > 192.168.1.55.38242: Flags [P.], seq 1449:7241, ack 139, win 508, options [nop,nop,TS val 41776372 ecr 3937263965], length 5792
00:09:02.931047 IP 192.168.1.56.3000 > 192.168.1.55.38242: Flags [P.], seq 7241:14481, ack 139, win 508, options [nop,nop,TS val 41776372 ecr 3937263965], length 7240
00:09:02.931079 IP 192.168.1.55.38242 > 192.168.1.56.3000: Flags [.], ack 7241, win 464, options [nop,nop,TS val 3937263970 ecr 41776372], length 0
00:09:02.931096 IP 192.168.1.55.38242 > 192.168.1.56.3000: Flags [.], ack 14481, win 417, options [nop,nop,TS val 3937263970 ecr 41776372], length 0
00:09:02.931220 IP 192.168.1.56.3000 > 192.168.1.55.38242: Flags [.], seq 14481:15929, ack 139, win 508, options [nop,nop,TS val 41776372 ecr 3937263970], length 1448
00:09:02.931238 IP 192.168.1.55.38242 > 192.168.1.56.3000: Flags [.], ack 15929, win 501, options [nop,nop,TS val 3937263970 ecr 41776372], length 0
00:09:02.931269 IP 192.168.1.56.3000 > 192.168.1.55.38242: Flags [P.], seq 15929:17453, ack 139, win 508, options [nop,nop,TS val 41776372 ecr 3937263970], length 1524
00:09:02.931281 IP 192.168.1.55.38242 > 192.168.1.56.3000: Flags [.], ack 17453, win 490, options [nop,nop,TS val 3937263970 ecr 41776372], length 0
00:09:02.932065 IP 192.168.1.56.3000 > 192.168.1.55.38242: Flags [F.], seq 17453, ack 139, win 508, options [nop,nop,TS val 41776373 ecr 3937263970], length 0
00:09:02.935454 IP 192.168.1.55.38062 > 192.168.1.56.3000: Flags [F.], seq 3401638607, ack 1240398202, win 501, options [nop,nop,TS val 3937263974 ecr 41519109], length 0
00:09:02.935566 IP 192.168.1.56.3000 > 192.168.1.55.38062: Flags [R], seq 1240398202, win 0, length 0
00:09:02.935611 IP 192.168.1.55.38066 > 192.168.1.56.3000: Flags [F.], seq 3671507906, ack 1781622454, win 501, options [nop,nop,TS val 3937263975 ecr 41519050], length 0
00:09:02.935667 IP 192.168.1.55.38068 > 192.168.1.56.3000: Flags [F.], seq 146369043, ack 413998051, win 501, options [nop,nop,TS val 3937263975 ecr 41519051], length 0
00:09:02.935692 IP 192.168.1.56.3000 > 192.168.1.55.38066: Flags [R], seq 1781622454, win 0, length 0
00:09:02.935755 IP 192.168.1.56.3000 > 192.168.1.55.38068: Flags [R], seq 413998051, win 0, length 0
00:09:02.935777 IP 192.168.1.55.38070 > 192.168.1.56.3000: Flags [F.], seq 1119959713, ack 873849020, win 501, options [nop,nop,TS val 3937263975 ecr 41519051], length 0
00:09:02.935846 IP 192.168.1.56.3000 > 192.168.1.55.38070: Flags [R], seq 873849020, win 0, length 0
00:09:02.935877 IP 192.168.1.55.38072 > 192.168.1.56.3000: Flags [F.], seq 4272525619, ack 1424724844, win 501, options [nop,nop,TS val 3937263975 ecr 41519051], length 0
00:09:02.935945 IP 192.168.1.56.3000 > 192.168.1.55.38072: Flags [R], seq 1424724844, win 0, length 0
00:09:02.936029 IP 192.168.1.55.38244 > 192.168.1.56.3000: Flags [S], seq 1487089480, win 64240, options [mss 1460,sackOK,TS val 3937263975 ecr 0,nop,wscale 7], length 0
00:09:02.936128 IP 192.168.1.56.3000 > 192.168.1.55.38244: Flags [S.], seq 166988045, ack 1487089481, win 65160, options [mss 1460,sackOK,TS val 41776377 ecr 3937263975,nop,wscale 7], length 0
00:09:02.936159 IP 192.168.1.55.38244 > 192.168.1.56.3000: Flags [.], ack 1, win 502, options [nop,nop,TS val 3937263975 ecr 41776377], length 0
00:09:02.936385 IP 192.168.1.55.38242 > 192.168.1.56.3000: Flags [F.], seq 139, ack 17454, win 501, options [nop,nop,TS val 3937263975 ecr 41776373], length 0
00:09:02.936481 IP 192.168.1.56.3000 > 192.168.1.55.38242: Flags [.], ack 140, win 508, options [nop,nop,TS val 41776378 ecr 3937263975], length 0
00:09:02.936689 IP 192.168.1.55.38244 > 192.168.1.56.3000: Flags [P.], seq 1:265, ack 1, win 502, options [nop,nop,TS val 3937263976 ecr 41776377], length 264
00:09:02.936747 IP 192.168.1.55.38244 > 192.168.1.56.3000: Flags [P.], seq 265:1134, ack 1, win 502, options [nop,nop,TS val 3937263976 ecr 41776377], length 869
00:09:02.936772 IP 192.168.1.56.3000 > 192.168.1.55.38244: Flags [.], ack 265, win 507, options [nop,nop,TS val 41776378 ecr 3937263976], length 0
00:09:02.936848 IP 192.168.1.56.3000 > 192.168.1.55.38244: Flags [.], ack 1134, win 501, options [nop,nop,TS val 41776378 ecr 3937263976], length 0
00:09:02.958203 IP 192.168.1.56.3000 > 192.168.1.55.38244: Flags [P.], seq 1:260, ack 1134, win 501, options [nop,nop,TS val 41776399 ecr 3937263976], length 259
00:09:02.958244 IP 192.168.1.55.38244 > 192.168.1.56.3000: Flags [.], ack 260, win 501, options [nop,nop,TS val 3937263997 ecr 41776399], length 0
00:09:02.967279 IP 192.168.1.55.38244 > 192.168.1.56.3000: Flags [P.], seq 1134:1414, ack 260, win 501, options [nop,nop,TS val 3937264006 ecr 41776399], length 280
00:09:02.967352 IP 192.168.1.56.3000 > 192.168.1.55.38244: Flags [.], ack 1414, win 501, options [nop,nop,TS val 41776408 ecr 3937264006], length 0
00:09:02.967553 IP 192.168.1.55.38250 > 192.168.1.56.3000: Flags [S], seq 873020925, win 64240, options [mss 1460,sackOK,TS val 3937264007 ecr 0,nop,wscale 7], length 0
00:09:02.967633 IP 192.168.1.56.3000 > 192.168.1.55.38250: Flags [S.], seq 509149899, ack 873020926, win 65160, options [mss 1460,sackOK,TS val 41776409 ecr 3937264007,nop,wscale 7], length 0
00:09:02.967662 IP 192.168.1.55.38250 > 192.168.1.56.3000: Flags [.], ack 1, win 502, options [nop,nop,TS val 3937264007 ecr 41776409], length 0
00:09:02.967774 IP 192.168.1.55.38252 > 192.168.1.56.3000: Flags [S], seq 2567385665, win 64240, options [mss 1460,sackOK,TS val 3937264007 ecr 0,nop,wscale 7], length 0
00:09:02.967837 IP 192.168.1.56.3000 > 192.168.1.55.38252: Flags [S.], seq 2032514717, ack 2567385666, win 65160, options [mss 1460,sackOK,TS val 41776409 ecr 3937264007,nop,wscale 7], length 0
00:09:02.967863 IP 192.168.1.55.38252 > 192.168.1.56.3000: Flags [.], ack 1, win 502, options [nop,nop,TS val 3937264007 ecr 41776409], length 0
00:09:02.968003 IP 192.168.1.55.38254 > 192.168.1.56.3000: Flags [S], seq 3492783579, win 64240, options [mss 1460,sackOK,TS val 3937264007 ecr 0,nop,wscale 7], length 0
00:09:02.968060 IP 192.168.1.56.3000 > 192.168.1.55.38254: Flags [S.], seq 4292760053, ack 3492783580, win 65160, options [mss 1460,sackOK,TS val 41776409 ecr 3937264007,nop,wscale 7], length 0
00:09:02.968083 IP 192.168.1.55.38254 > 192.168.1.56.3000: Flags [.], ack 1, win 502, options [nop,nop,TS val 3937264007 ecr 41776409], length 0
00:09:02.968151 IP 192.168.1.56.3000 > 192.168.1.55.38244: Flags [P.], seq 260:285, ack 1414, win 501, options [nop,nop,TS val 41776409 ecr 3937264006], length 25
00:09:02.968170 IP 192.168.1.55.38244 > 192.168.1.56.3000: Flags [.], ack 285, win 501, options [nop,nop,TS val 3937264007 ecr 41776409], length 0
00:09:02.968232 IP 192.168.1.55.38256 > 192.168.1.56.3000: Flags [S], seq 609489790, win 64240, options [mss 1460,sackOK,TS val 3937264007 ecr 0,nop,wscale 7], length 0
00:09:02.968292 IP 192.168.1.56.3000 > 192.168.1.55.38256: Flags [S.], seq 189582504, ack 609489791, win 65160, options [mss 1460,sackOK,TS val 41776409 ecr 3937264007,nop,wscale 7], length 0
00:09:02.968313 IP 192.168.1.55.38256 > 192.168.1.56.3000: Flags [.], ack 1, win 502, options [nop,nop,TS val 3937264007 ecr 41776409], length 0
00:09:02.968413 IP 192.168.1.55.38258 > 192.168.1.56.3000: Flags [S], seq 3572536799, win 64240, options [mss 1460,sackOK,TS val 3937264007 ecr 0,nop,wscale 7], length 0
00:09:02.968475 IP 192.168.1.56.3000 > 192.168.1.55.38258: Flags [S.], seq 733443257, ack 3572536800, win 65160, options [mss 1460,sackOK,TS val 41776410 ecr 3937264007,nop,wscale 7], length 0
00:09:02.968497 IP 192.168.1.55.38258 > 192.168.1.56.3000: Flags [.], ack 1, win 502, options [nop,nop,TS val 3937264008 ecr 41776410], length 0
00:09:02.968582 IP 192.168.1.55.38260 > 192.168.1.56.3000: Flags [S], seq 3850398167, win 64240, options [mss 1460,sackOK,TS val 3937264008 ecr 0,nop,wscale 7], length 0
00:09:02.968642 IP 192.168.1.56.3000 > 192.168.1.55.38260: Flags [S.], seq 2339656465, ack 3850398168, win 65160, options [mss 1460,sackOK,TS val 41776410 ecr 3937264008,nop,wscale 7], length 0
00:09:02.968661 IP 192.168.1.55.38260 > 192.168.1.56.3000: Flags [.], ack 1, win 502, options [nop,nop,TS val 3937264008 ecr 41776410], length 0
00:09:02.968757 IP 192.168.1.55.38262 > 192.168.1.56.3000: Flags [S], seq 1448227274, win 64240, options [mss 1460,sackOK,TS val 3937264008 ecr 0,nop,wscale 7], length 0
00:09:02.968812 IP 192.168.1.56.3000 > 192.168.1.55.38262: Flags [S.], seq 3402011194, ack 1448227275, win 65160, options [mss 1460,sackOK,TS val 41776410 ecr 3937264008,nop,wscale 7], length 0
00:09:02.968834 IP 192.168.1.55.38262 > 192.168.1.56.3000: Flags [.], ack 1, win 502, options [nop,nop,TS val 3937264008 ecr 41776410], length 0
00:09:02.968987 IP 192.168.1.55.38262 > 192.168.1.56.3000: Flags [P.], seq 1:281, ack 1, win 502, options [nop,nop,TS val 3937264008 ecr 41776410], length 280
00:09:02.969050 IP 192.168.1.56.3000 > 192.168.1.55.38262: Flags [.], ack 281, win 507, options [nop,nop,TS val 41776410 ecr 3937264008], length 0
00:09:02.969188 IP 192.168.1.55.38264 > 192.168.1.56.3000: Flags [S], seq 2817248447, win 64240, options [mss 1460,sackOK,TS val 3937264008 ecr 0,nop,wscale 7], length 0
00:09:02.969252 IP 192.168.1.56.3000 > 192.168.1.55.38264: Flags [S.], seq 1981426369, ack 2817248448, win 65160, options [mss 1460,sackOK,TS val 41776410 ecr 3937264008,nop,wscale 7], length 0
00:09:02.969279 IP 192.168.1.55.38264 > 192.168.1.56.3000: Flags [.], ack 1, win 502, options [nop,nop,TS val 3937264008 ecr 41776410], length 0
00:09:02.969644 IP 192.168.1.55.38250 > 192.168.1.56.3000: Flags [P.], seq 1:281, ack 1, win 502, options [nop,nop,TS val 3937264009 ecr 41776409], length 280
00:09:02.969729 IP 192.168.1.56.3000 > 192.168.1.55.38250: Flags [.], ack 281, win 507, options [nop,nop,TS val 41776411 ecr 3937264009], length 0
00:09:02.969819 IP 192.168.1.55.38252 > 192.168.1.56.3000: Flags [P.], seq 1:281, ack 1, win 502, options [nop,nop,TS val 3937264009 ecr 41776409], length 280
00:09:02.969874 IP 192.168.1.56.3000 > 192.168.1.55.38252: Flags [.], ack 281, win 507, options [nop,nop,TS val 41776411 ecr 3937264009], length 0
00:09:02.970042 IP 192.168.1.55.38254 > 192.168.1.56.3000: Flags [P.], seq 1:281, ack 1, win 502, options [nop,nop,TS val 3937264009 ecr 41776409], length 280
00:09:02.970107 IP 192.168.1.56.3000 > 192.168.1.55.38254: Flags [.], ack 281, win 507, options [nop,nop,TS val 41776411 ecr 3937264009], length 0
00:09:02.970202 IP 192.168.1.55.38256 > 192.168.1.56.3000: Flags [P.], seq 1:281, ack 1, win 502, options [nop,nop,TS val 3937264009 ecr 41776409], length 280
00:09:02.970279 IP 192.168.1.56.3000 > 192.168.1.55.38256: Flags [.], ack 281, win 507, options [nop,nop,TS val 41776411 ecr 3937264009], length 0
00:09:02.970375 IP 192.168.1.55.38258 > 192.168.1.56.3000: Flags [P.], seq 1:281, ack 1, win 502, options [nop,nop,TS val 3937264009 ecr 41776410], length 280
00:09:02.970435 IP 192.168.1.56.3000 > 192.168.1.55.38258: Flags [.], ack 281, win 507, options [nop,nop,TS val 41776412 ecr 3937264009], length 0
00:09:02.970529 IP 192.168.1.55.38260 > 192.168.1.56.3000: Flags [P.], seq 1:281, ack 1, win 502, options [nop,nop,TS val 3937264010 ecr 41776410], length 280
00:09:02.970586 IP 192.168.1.56.3000 > 192.168.1.55.38260: Flags [.], ack 281, win 507, options [nop,nop,TS val 41776412 ecr 3937264010], length 0
00:09:02.970683 IP 192.168.1.55.38264 > 192.168.1.56.3000: Flags [P.], seq 1:279, ack 1, win 502, options [nop,nop,TS val 3937264010 ecr 41776410], length 278
00:09:02.970744 IP 192.168.1.56.3000 > 192.168.1.55.38264: Flags [.], ack 279, win 507, options [nop,nop,TS val 41776412 ecr 3937264010], length 0
00:09:02.971091 IP 192.168.1.55.38244 > 192.168.1.56.3000: Flags [.], seq 1414:2862, ack 285, win 501, options [nop,nop,TS val 3937264010 ecr 41776409], length 1448
00:09:02.971107 IP 192.168.1.55.38244 > 192.168.1.56.3000: Flags [.], seq 2862:4310, ack 285, win 501, options [nop,nop,TS val 3937264010 ecr 41776409], length 1448
00:09:02.971112 IP 192.168.1.55.38244 > 192.168.1.56.3000: Flags [.], seq 4310:5758, ack 285, win 501, options [nop,nop,TS val 3937264010 ecr 41776409], length 1448
00:09:02.971118 IP 192.168.1.55.38244 > 192.168.1.56.3000: Flags [.], seq 5758:7206, ack 285, win 501, options [nop,nop,TS val 3937264010 ecr 41776409], length 1448
00:09:02.971124 IP 192.168.1.55.38244 > 192.168.1.56.3000: Flags [P.], seq 7206:8654, ack 285, win 501, options [nop,nop,TS val 3937264010 ecr 41776409], length 1448
00:09:02.971171 IP 192.168.1.55.38244 > 192.168.1.56.3000: Flags [.], seq 8654:10102, ack 285, win 501, options [nop,nop,TS val 3937264010 ecr 41776409], length 1448
00:09:02.971176 IP 192.168.1.55.38244 > 192.168.1.56.3000: Flags [.], seq 10102:11550, ack 285, win 501, options [nop,nop,TS val 3937264010 ecr 41776409], length 1448
00:09:02.971180 IP 192.168.1.55.38244 > 192.168.1.56.3000: Flags [.], seq 11550:12998, ack 285, win 501, options [nop,nop,TS val 3937264010 ecr 41776409], length 1448
00:09:02.971216 IP 192.168.1.56.3000 > 192.168.1.55.38244: Flags [.], ack 2862, win 501, options [nop,nop,TS val 41776412 ecr 3937264010], length 0
00:09:02.971254 IP 192.168.1.56.3000 > 192.168.1.55.38244: Flags [.], ack 7206, win 474, options [nop,nop,TS val 41776412 ecr 3937264010], length 0
00:09:02.971279 IP 192.168.1.56.3000 > 192.168.1.55.38244: Flags [.], ack 8654, win 464, options [nop,nop,TS val 41776412 ecr 3937264010], length 0
00:09:02.971311 IP 192.168.1.55.38244 > 192.168.1.56.3000: Flags [.], seq 15894:17342, ack 285, win 501, options [nop,nop,TS val 3937264010 ecr 41776412], length 1448
00:09:02.971316 IP 192.168.1.55.38244 > 192.168.1.56.3000: Flags [.], seq 17342:18790, ack 285, win 501, options [nop,nop,TS val 3937264010 ecr 41776412], length 1448
00:09:02.971320 IP 192.168.1.55.38244 > 192.168.1.56.3000: Flags [.], seq 18790:20238, ack 285, win 501, options [nop,nop,TS val 3937264010 ecr 41776412], length 1448
00:09:02.971324 IP 192.168.1.55.38244 > 192.168.1.56.3000: Flags [.], seq 20238:21686, ack 285, win 501, options [nop,nop,TS val 3937264010 ecr 41776412], length 1448
00:09:02.971327 IP 192.168.1.55.38244 > 192.168.1.56.3000: Flags [.], seq 21686:23134, ack 285, win 501, options [nop,nop,TS val 3937264010 ecr 41776412], length 1448
00:09:02.971331 IP 192.168.1.55.38244 > 192.168.1.56.3000: Flags [.], seq 23134:24582, ack 285, win 501, options [nop,nop,TS val 3937264010 ecr 41776412], length 1448
00:09:02.971345 IP 192.168.1.56.3000 > 192.168.1.55.38244: Flags [.], ack 12998, win 436, options [nop,nop,TS val 41776412 ecr 3937264010], length 0
00:09:02.971358 IP 192.168.1.56.3000 > 192.168.1.55.38244: Flags [.], ack 15894, win 417, options [nop,nop,TS val 41776412 ecr 3937264010], length 0
00:09:02.971407 IP 192.168.1.55.38244 > 192.168.1.56.3000: Flags [.], seq 26030:27478, ack 285, win 501, options [nop,nop,TS val 3937264010 ecr 41776412], length 1448
00:09:02.971412 IP 192.168.1.55.38244 > 192.168.1.56.3000: Flags [.], seq 27478:28926, ack 285, win 501, options [nop,nop,TS val 3937264010 ecr 41776412], length 1448
00:09:02.971416 IP 192.168.1.55.38244 > 192.168.1.56.3000: Flags [.], seq 28926:30374, ack 285, win 501, options [nop,nop,TS val 3937264010 ecr 41776412], length 1448
00:09:02.971420 IP 192.168.1.55.38244 > 192.168.1.56.3000: Flags [.], seq 30374:31822, ack 285, win 501, options [nop,nop,TS val 3937264010 ecr 41776412], length 1448
00:09:02.971465 IP 192.168.1.56.3000 > 192.168.1.55.38244: Flags [.], ack 17342, win 407, options [nop,nop,TS val 41776412 ecr 3937264010], length 0
00:09:02.971474 IP 192.168.1.56.3000 > 192.168.1.55.38244: Flags [.], ack 20238, win 388, options [nop,nop,TS val 41776413 ecr 3937264010], length 0
00:09:02.971484 IP 192.168.1.55.38244 > 192.168.1.56.3000: Flags [.], seq 36166:37614, ack 285, win 501, options [nop,nop,TS val 3937264010 ecr 41776412], length 1448
00:09:02.971489 IP 192.168.1.55.38244 > 192.168.1.56.3000: Flags [P.], seq 37614:39062, ack 285, win 501, options [nop,nop,TS val 3937264010 ecr 41776412], length 1448
00:09:02.971504 IP 192.168.1.56.3000 > 192.168.1.55.38244: Flags [.], ack 24582, win 360, options [nop,nop,TS val 41776413 ecr 3937264010], length 0
00:09:02.971522 IP 192.168.1.56.3000 > 192.168.1.55.38244: Flags [.], ack 26030, win 350, options [nop,nop,TS val 41776413 ecr 3937264010], length 0
00:09:02.971538 IP 192.168.1.56.3000 > 192.168.1.55.38244: Flags [.], ack 28926, win 330, options [nop,nop,TS val 41776413 ecr 3937264010], length 0
00:09:02.971580 IP 192.168.1.55.38244 > 192.168.1.56.3000: Flags [.], seq 39062:40510, ack 285, win 501, options [nop,nop,TS val 3937264011 ecr 41776413], length 1448
00:09:02.971584 IP 192.168.1.55.38244 > 192.168.1.56.3000: Flags [.], seq 40510:41958, ack 285, win 501, options [nop,nop,TS val 3937264011 ecr 41776413], length 1448
00:09:02.971588 IP 192.168.1.55.38244 > 192.168.1.56.3000: Flags [.], seq 41958:43406, ack 285, win 501, options [nop,nop,TS val 3937264011 ecr 41776413], length 1448
00:09:02.971592 IP 192.168.1.55.38244 > 192.168.1.56.3000: Flags [.], seq 43406:44854, ack 285, win 501, options [nop,nop,TS val 3937264011 ecr 41776413], length 1448
00:09:02.971599 IP 192.168.1.55.38244 > 192.168.1.56.3000: Flags [P.], seq 46302:47750, ack 285, win 501, options [nop,nop,TS val 3937264011 ecr 41776413], length 1448
00:09:02.971756 IP 192.168.1.55.38244 > 192.168.1.56.3000: Flags [.], seq 47750:49198, ack 285, win 501, options [nop,nop,TS val 3937264011 ecr 41776413], length 1448
00:09:02.971766 IP 192.168.1.55.38244 > 192.168.1.56.3000: Flags [.], seq 49198:50646, ack 285, win 501, options [nop,nop,TS val 3937264011 ecr 41776413], length 1448
00:09:02.971771 IP 192.168.1.55.38244 > 192.168.1.56.3000: Flags [.], seq 50646:52094, ack 285, win 501, options [nop,nop,TS val 3937264011 ecr 41776413], length 1448
00:09:02.971776 IP 192.168.1.55.38244 > 192.168.1.56.3000: Flags [.], seq 52094:53542, ack 285, win 501, options [nop,nop,TS val 3937264011 ecr 41776413], length 1448
00:09:02.971782 IP 192.168.1.55.38244 > 192.168.1.56.3000: Flags [.], seq 53542:54990, ack 285, win 501, options [nop,nop,TS val 3937264011 ecr 41776413], length 1448
00:09:02.971788 IP 192.168.1.55.38244 > 192.168.1.56.3000: Flags [.], seq 54990:56438, ack 285, win 501, options [nop,nop,TS val 3937264011 ecr 41776413], length 1448
00:09:02.971793 IP 192.168.1.55.38244 > 192.168.1.56.3000: Flags [.], seq 56438:57886, ack 285, win 501, options [nop,nop,TS val 3937264011 ecr 41776413], length 1448
00:09:02.972057 IP 192.168.1.55.38244 > 192.168.1.56.3000: Flags [.], seq 60782:62230, ack 285, win 501, options [nop,nop,TS val 3937264011 ecr 41776413], length 1448
00:09:02.973417 IP 192.168.1.56.3000 > 192.168.1.55.38244: Flags [.], ack 62230, win 501, options [nop,nop,TS val 41776414 ecr 3937264010], length 0
00:09:02.973520 IP 192.168.1.55.38244 > 192.168.1.56.3000: Flags [.], seq 62230:63678, ack 285, win 501, options [nop,nop,TS val 3937264013 ecr 41776414], length 1448
00:09:02.973526 IP 192.168.1.55.38244 > 192.168.1.56.3000: Flags [.], seq 63678:65126, ack 285, win 501, options [nop,nop,TS val 3937264013 ecr 41776414], length 1448
00:09:02.973531 IP 192.168.1.55.38244 > 192.168.1.56.3000: Flags [.], seq 65126:66574, ack 285, win 501, options [nop,nop,TS val 3937264013 ecr 41776414], length 1448
00:09:02.973536 IP 192.168.1.55.38244 > 192.168.1.56.3000: Flags [.], seq 66574:68022, ack 285, win 501, options [nop,nop,TS val 3937264013 ecr 41776414], length 1448
00:09:02.973540 IP 192.168.1.55.38244 > 192.168.1.56.3000: Flags [.], seq 68022:69470, ack 285, win 501, options [nop,nop,TS val 3937264013 ecr 41776414], length 1448
00:09:02.973544 IP 192.168.1.55.38244 > 192.168.1.56.3000: Flags [.], seq 69470:70918, ack 285, win 501, options [nop,nop,TS val 3937264013 ecr 41776414], length 1448
00:09:02.973548 IP 192.168.1.55.38244 > 192.168.1.56.3000: Flags [.], seq 70918:72366, ack 285, win 501, options [nop,nop,TS val 3937264013 ecr 41776414], length 1448
00:09:02.973602 IP 192.168.1.55.38244 > 192.168.1.56.3000: Flags [.], seq 76710:78158, ack 285, win 501, options [nop,nop,TS val 3937264013 ecr 41776414], length 1448
00:09:02.973606 IP 192.168.1.55.38244 > 192.168.1.56.3000: Flags [.], seq 78158:79606, ack 285, win 501, options [nop,nop,TS val 3937264013 ecr 41776414], length 1448
00:09:02.973610 IP 192.168.1.55.38244 > 192.168.1.56.3000: Flags [.], seq 79606:81054, ack 285, win 501, options [nop,nop,TS val 3937264013 ecr 41776414], length 1448
00:09:02.973671 IP 192.168.1.56.3000 > 192.168.1.55.38244: Flags [.], ack 63678, win 524, options [nop,nop,TS val 41776415 ecr 3937264013], length 0
00:09:02.973733 IP 192.168.1.55.38244 > 192.168.1.56.3000: Flags [.], seq 82502:83950, ack 285, win 501, options [nop,nop,TS val 3937264013 ecr 41776414], length 1448
00:09:02.973739 IP 192.168.1.55.38244 > 192.168.1.56.3000: Flags [.], seq 83950:85398, ack 285, win 501, options [nop,nop,TS val 3937264013 ecr 41776414], length 1448
00:09:02.973745 IP 192.168.1.55.38244 > 192.168.1.56.3000: Flags [.], seq 85398:86846, ack 285, win 501, options [nop,nop,TS val 3937264013 ecr 41776414], length 1448
00:09:02.973750 IP 192.168.1.55.38244 > 192.168.1.56.3000: Flags [.], seq 86846:88294, ack 285, win 501, options [nop,nop,TS val 3937264013 ecr 41776414], length 1448
00:09:02.973754 IP 192.168.1.55.38244 > 192.168.1.56.3000: Flags [.], seq 88294:89742, ack 285, win 501, options [nop,nop,TS val 3937264013 ecr 41776414], length 1448
00:09:02.973759 IP 192.168.1.55.38244 > 192.168.1.56.3000: Flags [P.], seq 89742:91190, ack 285, win 501, options [nop,nop,TS val 3937264013 ecr 41776414], length 1448
00:09:02.973768 IP 192.168.1.56.3000 > 192.168.1.55.38244: Flags [.], ack 69470, win 614, options [nop,nop,TS val 41776415 ecr 3937264013], length 0
00:09:02.973792 IP 192.168.1.55.38244 > 192.168.1.56.3000: Flags [.], seq 91190:92638, ack 285, win 501, options [nop,nop,TS val 3937264013 ecr 41776415], length 1448
00:09:02.973796 IP 192.168.1.55.38244 > 192.168.1.56.3000: Flags [P.], seq 92638:94086, ack 285, win 501, options [nop,nop,TS val 3937264013 ecr 41776415], length 1448
00:09:02.973820 IP 192.168.1.56.3000 > 192.168.1.55.38244: Flags [.], ack 73814, win 682, options [nop,nop,TS val 41776415 ecr 3937264013], length 0
00:09:02.973847 IP 192.168.1.55.38244 > 192.168.1.56.3000: Flags [.], seq 94086:95534, ack 285, win 501, options [nop,nop,TS val 3937264013 ecr 41776415], length 1448
00:09:02.973851 IP 192.168.1.55.38244 > 192.168.1.56.3000: Flags [.], seq 95534:96982, ack 285, win 501, options [nop,nop,TS val 3937264013 ecr 41776415], length 1448
00:09:02.973855 IP 192.168.1.55.38244 > 192.168.1.56.3000: Flags [.], seq 96982:98430, ack 285, win 501, options [nop,nop,TS val 3937264013 ecr 41776415], length 1448
00:09:02.973859 IP 192.168.1.55.38244 > 192.168.1.56.3000: Flags [.], seq 98430:99878, ack 285, win 501, options [nop,nop,TS val 3937264013 ecr 41776415], length 1448
00:09:02.973877 IP 192.168.1.56.3000 > 192.168.1.55.38244: Flags [.], ack 76710, win 727, options [nop,nop,TS val 41776415 ecr 3937264013], length 0
00:09:02.973915 IP 192.168.1.55.38244 > 192.168.1.56.3000: Flags [.], seq 101326:102774, ack 285, win 501, options [nop,nop,TS val 3937264013 ecr 41776415], length 1448
00:09:02.973920 IP 192.168.1.55.38244 > 192.168.1.56.3000: Flags [P.], seq 102774:104222, ack 285, win 501, options [nop,nop,TS val 3937264013 ecr 41776415], length 1448
00:09:02.973929 IP 192.168.1.56.3000 > 192.168.1.55.38244: Flags [.], ack 78158, win 750, options [nop,nop,TS val 41776415 ecr 3937264013], length 0
00:09:02.973941 IP 192.168.1.56.3000 > 192.168.1.55.38244: Flags [.], ack 83950, win 840, options [nop,nop,TS val 41776415 ecr 3937264013], length 0
00:09:02.973966 IP 192.168.1.55.38244 > 192.168.1.56.3000: Flags [.], seq 104222:105670, ack 285, win 501, options [nop,nop,TS val 3937264013 ecr 41776415], length 1448
00:09:02.973975 IP 192.168.1.55.38244 > 192.168.1.56.3000: Flags [.], seq 108566:110014, ack 285, win 501, options [nop,nop,TS val 3937264013 ecr 41776415], length 1448
00:09:02.973997 IP 192.168.1.56.3000 > 192.168.1.55.38244: Flags [.], ack 88294, win 908, options [nop,nop,TS val 41776415 ecr 3937264013], length 0
00:09:02.974009 IP 192.168.1.56.3000 > 192.168.1.55.38244: Flags [.], ack 91190, win 954, options [nop,nop,TS val 41776415 ecr 3937264013], length 0
00:09:02.974047 IP 192.168.1.55.38244 > 192.168.1.56.3000: Flags [.], seq 114358:115806, ack 285, win 501, options [nop,nop,TS val 3937264013 ecr 41776415], length 1448
00:09:02.974051 IP 192.168.1.55.38244 > 192.168.1.56.3000: Flags [.], seq 115806:117254, ack 285, win 501, options [nop,nop,TS val 3937264013 ecr 41776415], length 1448
00:09:02.974058 IP 192.168.1.55.38244 > 192.168.1.56.3000: Flags [.], seq 118702:120150, ack 285, win 501, options [nop,nop,TS val 3937264013 ecr 41776415], length 1448
00:09:02.974100 IP 192.168.1.55.38244 > 192.168.1.56.3000: Flags [.], seq 120150:121598, ack 285, win 501, options [nop,nop,TS val 3937264013 ecr 41776415], length 1448
00:09:02.974105 IP 192.168.1.55.38244 > 192.168.1.56.3000: Flags [.], seq 121598:123046, ack 285, win 501, options [nop,nop,TS val 3937264013 ecr 41776415], length 1448
00:09:02.974110 IP 192.168.1.55.38244 > 192.168.1.56.3000: Flags [P.], seq 123046:123550, ack 285, win 501, options [nop,nop,TS val 3937264013 ecr 41776415], length 504
00:09:02.974129 IP 192.168.1.56.3000 > 192.168.1.55.38244: Flags [.], ack 101326, win 1112, options [nop,nop,TS val 41776415 ecr 3937264013], length 0
00:09:02.974143 IP 192.168.1.56.3000 > 192.168.1.55.38244: Flags [.], ack 104222, win 1157, options [nop,nop,TS val 41776415 ecr 3937264013], length 0
00:09:02.974163 IP 192.168.1.56.3000 > 192.168.1.55.38244: Flags [.], ack 108566, win 1225, options [nop,nop,TS val 41776415 ecr 3937264013], length 0
00:09:02.974173 IP 192.168.1.56.3000 > 192.168.1.55.38244: Flags [.], ack 111462, win 1226, options [nop,nop,TS val 41776415 ecr 3937264013], length 0
00:09:02.976214 IP 192.168.1.56.3000 > 192.168.1.55.38250: Flags [P.], seq 1:26, ack 281, win 507, options [nop,nop,TS val 41776417 ecr 3937264009], length 25
00:09:02.976251 IP 192.168.1.55.38250 > 192.168.1.56.3000: Flags [.], ack 26, win 502, options [nop,nop,TS val 3937264015 ecr 41776417], length 0
00:09:02.976831 IP 192.168.1.55.38250 > 192.168.1.56.3000: Flags [.], seq 281:1729, ack 26, win 502, options [nop,nop,TS val 3937264016 ecr 41776417], length 1448
00:09:02.976850 IP 192.168.1.55.38250 > 192.168.1.56.3000: Flags [.], seq 1729:3177, ack 26, win 502, options [nop,nop,TS val 3937264016 ecr 41776417], length 1448
00:09:02.976856 IP 192.168.1.55.38250 > 192.168.1.56.3000: Flags [.], seq 3177:4625, ack 26, win 502, options [nop,nop,TS val 3937264016 ecr 41776417], length 1448
00:09:02.976863 IP 192.168.1.55.38250 > 192.168.1.56.3000: Flags [.], seq 4625:6073, ack 26, win 502, options [nop,nop,TS val 3937264016 ecr 41776417], length 1448
00:09:02.976869 IP 192.168.1.55.38250 > 192.168.1.56.3000: Flags [P.], seq 6073:7521, ack 26, win 502, options [nop,nop,TS val 3937264016 ecr 41776417], length 1448
00:09:02.976919 IP 192.168.1.55.38250 > 192.168.1.56.3000: Flags [.], seq 7521:8969, ack 26, win 502, options [nop,nop,TS val 3937264016 ecr 41776417], length 1448
00:09:02.976924 IP 192.168.1.55.38250 > 192.168.1.56.3000: Flags [.], seq 8969:10417, ack 26, win 502, options [nop,nop,TS val 3937264016 ecr 41776417], length 1448
00:09:02.976928 IP 192.168.1.55.38250 > 192.168.1.56.3000: Flags [.], seq 10417:11865, ack 26, win 502, options [nop,nop,TS val 3937264016 ecr 41776417], length 1448
00:09:02.976991 IP 192.168.1.56.3000 > 192.168.1.55.38250: Flags [.], ack 3177, win 493, options [nop,nop,TS val 41776418 ecr 3937264016], length 0
00:09:02.977041 IP 192.168.1.55.38250 > 192.168.1.56.3000: Flags [.], seq 14761:16209, ack 26, win 502, options [nop,nop,TS val 3937264016 ecr 41776418], length 1448
00:09:02.977045 IP 192.168.1.55.38250 > 192.168.1.56.3000: Flags [.], seq 16209:17657, ack 26, win 502, options [nop,nop,TS val 3937264016 ecr 41776418], length 1448
00:09:02.977052 IP 192.168.1.55.38250 > 192.168.1.56.3000: Flags [.], seq 17657:19105, ack 26, win 502, options [nop,nop,TS val 3937264016 ecr 41776418], length 1448
00:09:02.977056 IP 192.168.1.55.38250 > 192.168.1.56.3000: Flags [P.], seq 19105:20553, ack 26, win 502, options [nop,nop,TS val 3937264016 ecr 41776418], length 1448
00:09:02.977066 IP 192.168.1.56.3000 > 192.168.1.55.38250: Flags [.], ack 7521, win 464, options [nop,nop,TS val 41776418 ecr 3937264016], length 0
00:09:02.977074 IP 192.168.1.56.3000 > 192.168.1.55.38250: Flags [.], ack 11865, win 436, options [nop,nop,TS val 41776418 ecr 3937264016], length 0
00:09:02.977094 IP 192.168.1.56.3000 > 192.168.1.55.38250: Flags [.], ack 14761, win 417, options [nop,nop,TS val 41776418 ecr 3937264016], length 0
00:09:02.977119 IP 192.168.1.56.3000 > 192.168.1.55.38250: Flags [.], ack 16209, win 407, options [nop,nop,TS val 41776418 ecr 3937264016], length 0
00:09:02.977153 IP 192.168.1.55.38250 > 192.168.1.56.3000: Flags [.], seq 20553:22001, ack 26, win 502, options [nop,nop,TS val 3937264016 ecr 41776418], length 1448
00:09:02.977157 IP 192.168.1.55.38250 > 192.168.1.56.3000: Flags [.], seq 22001:23449, ack 26, win 502, options [nop,nop,TS val 3937264016 ecr 41776418], length 1448
00:09:02.977161 IP 192.168.1.55.38250 > 192.168.1.56.3000: Flags [.], seq 23449:24897, ack 26, win 502, options [nop,nop,TS val 3937264016 ecr 41776418], length 1448
00:09:02.977165 IP 192.168.1.55.38250 > 192.168.1.56.3000: Flags [.], seq 24897:26345, ack 26, win 502, options [nop,nop,TS val 3937264016 ecr 41776418], length 1448
00:09:02.977175 IP 192.168.1.55.38250 > 192.168.1.56.3000: Flags [.], seq 29241:30689, ack 26, win 502, options [nop,nop,TS val 3937264016 ecr 41776418], length 1448
00:09:02.977192 IP 192.168.1.56.3000 > 192.168.1.55.38250: Flags [.], ack 17657, win 398, options [nop,nop,TS val 41776418 ecr 3937264016], length 0
00:09:02.977246 IP 192.168.1.56.3000 > 192.168.1.55.38250: Flags [.], ack 22001, win 369, options [nop,nop,TS val 41776418 ecr 3937264016], length 0
00:09:02.977285 IP 192.168.1.56.3000 > 192.168.1.55.38250: Flags [.], ack 24897, win 350, options [nop,nop,TS val 41776418 ecr 3937264016], length 0
00:09:02.977327 IP 192.168.1.55.38250 > 192.168.1.56.3000: Flags [.], seq 33585:35033, ack 26, win 502, options [nop,nop,TS val 3937264016 ecr 41776418], length 1448
00:09:02.977332 IP 192.168.1.55.38250 > 192.168.1.56.3000: Flags [.], seq 35033:36481, ack 26, win 502, options [nop,nop,TS val 3937264016 ecr 41776418], length 1448
00:09:02.977336 IP 192.168.1.55.38250 > 192.168.1.56.3000: Flags [.], seq 36481:37929, ack 26, win 502, options [nop,nop,TS val 3937264016 ecr 41776418], length 1448
00:09:02.977340 IP 192.168.1.55.38250 > 192.168.1.56.3000: Flags [.], seq 37929:39377, ack 26, win 502, options [nop,nop,TS val 3937264016 ecr 41776418], length 1448
00:09:02.977343 IP 192.168.1.55.38250 > 192.168.1.56.3000: Flags [.], seq 39377:40825, ack 26, win 502, options [nop,nop,TS val 3937264016 ecr 41776418], length 1448
00:09:02.977347 IP 192.168.1.55.38250 > 192.168.1.56.3000: Flags [.], seq 40825:42273, ack 26, win 502, options [nop,nop,TS val 3937264016 ecr 41776418], length 1448
00:09:02.977351 IP 192.168.1.55.38250 > 192.168.1.56.3000: Flags [.], seq 42273:43721, ack 26, win 502, options [nop,nop,TS val 3937264016 ecr 41776418], length 1448
00:09:02.977355 IP 192.168.1.55.38250 > 192.168.1.56.3000: Flags [.], seq 43721:45169, ack 26, win 502, options [nop,nop,TS val 3937264016 ecr 41776418], length 1448
00:09:02.977378 IP 192.168.1.56.3000 > 192.168.1.55.38250: Flags [.], ack 32137, win 302, options [nop,nop,TS val 41776418 ecr 3937264016], length 0
00:09:02.977432 IP 192.168.1.56.3000 > 192.168.1.55.38250: Flags [.], ack 35033, win 283, options [nop,nop,TS val 41776419 ecr 3937264016], length 0
00:09:02.977463 IP 192.168.1.56.3000 > 192.168.1.55.38250: Flags [.], ack 37929, win 264, options [nop,nop,TS val 41776419 ecr 3937264016], length 0
00:09:02.977554 IP 192.168.1.55.38250 > 192.168.1.56.3000: Flags [.], seq 46617:48065, ack 26, win 502, options [nop,nop,TS val 3937264017 ecr 41776419], length 1448
00:09:02.977561 IP 192.168.1.55.38250 > 192.168.1.56.3000: Flags [.], seq 48065:49513, ack 26, win 502, options [nop,nop,TS val 3937264017 ecr 41776419], length 1448
00:09:02.977567 IP 192.168.1.55.38250 > 192.168.1.56.3000: Flags [.], seq 49513:50961, ack 26, win 502, options [nop,nop,TS val 3937264017 ecr 41776419], length 1448
00:09:02.977573 IP 192.168.1.55.38250 > 192.168.1.56.3000: Flags [.], seq 50961:52409, ack 26, win 502, options [nop,nop,TS val 3937264017 ecr 41776419], length 1448
